# name: test/sql/data_inlining/long_column_name_inlining.test
# description: Column names longer than 63 characters should work with data inlining
# group: [data_inlining]

require ducklake

require parquet

test-env DUCKLAKE_CONNECTION __TEST_DIR__/{UUID}.db

test-env DATA_PATH __TEST_DIR__

statement ok
ATTACH 'ducklake:${DUCKLAKE_CONNECTION}' AS lake (DATA_PATH '${DATA_PATH}/long_col_name/', DATA_INLINING_ROW_LIMIT 100)

statement ok
CREATE TABLE lake.test_long_col (
    id INTEGER,
    this_is_a_very_long_column_name_that_exceeds_sixty_four_characters_limit VARCHAR
);

statement ok
INSERT INTO lake.test_long_col VALUES (1, 'First');

statement ok
INSERT INTO lake.test_long_col VALUES (2, 'Second');

query II
SELECT * FROM lake.test_long_col ORDER BY id
----
1	First
2	Second

# verify the long column name works in projections
query I
SELECT this_is_a_very_long_column_name_that_exceeds_sixty_four_characters_limit FROM lake.test_long_col ORDER BY id
----
First
Second

# verify updates work
statement ok
UPDATE lake.test_long_col SET this_is_a_very_long_column_name_that_exceeds_sixty_four_characters_limit = 'Updated' WHERE id = 1;

query II
SELECT * FROM lake.test_long_col ORDER BY id
----
1	Updated
2	Second
